{
  "schemaVersion": 1,
  "date": "2026-07-08",
  "generatedAt": "2026-07-08T08:11:47-04:00",
  "title": "The Daily Brief",
  "subtitle": "for Anthony — Wednesday, July 8, 2026",
  "readMinutes": 7,
  "meta": {
    "generator": "daily-brief · first run (hand-run)",
    "modulesRun": ["faith", "arts", "civic", "tech", "serendipity"],
    "sourcesConsulted": 13,
    "notes": "First real brief, generated by hand to prove the pipeline end-to-end. Personal context (calendar + inbox) is off until those connectors are authorized. From here the morning routine produces this automatically."
  },
  "sections": [
    { "kind": "masthead", "title": "The Daily Brief" },

    {
      "kind": "headline",
      "title": "Today, in one line",
      "text": "Two homes of yours had a consequential week: the 227th General Assembly just reset where the PC(USA) puts its moral weight, and Philadelphia began pouring $100M into its neighborhoods for America's 250th — including grants your own church could claim."
    },

    {
      "kind": "module",
      "id": "faith",
      "title": "Faith & Ministry",
      "glyph": "✝",
      "accent": "gold",
      "summary": "The 227th General Assembly has adjourned, and its decisions will shape denominational advocacy for years.",
      "items": [
        {
          "lens": "Denominational news",
          "headline": "General Assembly declares the war in Gaza a genocide and divests",
          "body": "Meeting in Milwaukee through July 2, the 227th General Assembly voted 454–15 to name Israel's war in Gaza a genocide and to lobby Congress for an arms embargo, days after unanimously divesting from Palantir and GE Aerospace. Assembly staff say the actions give the denomination's advocacy offices new clarity on everything from Christian nationalism to gun violence and poverty.",
          "why": "However you read the substance, this is now your denomination's official posture — worth understanding before it comes up in session or coffee hour.",
          "source": { "name": "Religion News Service", "url": "https://religionnews.com/2026/07/01/pcusa-calls-war-in-gaza-a-genocide-and-divests-from-complicit-corporations/", "date": "Jul 1, 2026", "confidence": "confirmed" }
        },
        {
          "lens": "One idea to sit with",
          "headline": "A quieter, structural step on LGBTQIA+ inclusion",
          "body": "Commissioners approved an optional feature letting congregations signal openness to calling an LGBTQIA+ pastor through the Ministry Discernment Profile, and advanced a sweeping new study on sexuality and family. Less a headline than a slow reshaping of how congregations and candidates find each other.",
          "source": { "name": "Presbyterian Church (U.S.A.)", "url": "https://pcusa.org/news-storytelling/news/2026/7/1/ga-resolutions-embolden-national-and-global-advocacy", "date": "Jul 1, 2026", "confidence": "confirmed" }
        },
        {
          "lens": "A note of realism",
          "headline": "Still more than a million members",
          "body": "Amid the decline story, the PC(USA) reported total 2025 membership of 1,019,003 — still a denomination of over a million people. A useful number to hold next to the anxiety.",
          "source": { "name": "Presbyterian Church (U.S.A.)", "url": "https://pcusa.org/news-storytelling/news/2026/6/29/pcusa-still-home-more-1-million-members", "date": "Jun 29, 2026", "confidence": "confirmed" }
        },
        {
          "lens": "Lectionary — this coming Sunday",
          "headline": "Proper 10 (Year A): the Parable of the Sower",
          "body": "Sunday, July 12 brings Matthew 13:1–9, 18–23 — the sower and the soils — paired with Jacob and Esau (Genesis 25:19–34), Romans 8:1–11, and Psalm 119:105–112. A rich week for anyone preaching or reflecting on what makes a word take root.",
          "source": { "name": "Vanderbilt Divinity Lectionary", "url": "https://lectionary.library.vanderbilt.edu/2026/07/july-12-2026-proper-10-15/", "date": "Jul 12, 2026", "confidence": "confirmed" }
        }
      ]
    },

    {
      "kind": "module",
      "id": "arts",
      "title": "Arts & Culture",
      "glyph": "◈",
      "accent": "ember",
      "summary": "From the Whitney's open collection — one thing to see, one to sit with.",
      "items": [
        {
          "lens": "What's on view",
          "headline": "‘Andy Warhol: Family Album’ and the 2026 Biennial, both up now",
          "body": "The Whitney is showing Andy Warhol: Family Album (through Oct 19) alongside the Whitney Biennial 2026 (through Aug 23) and Kelly Akashi's Hyundai Terrace Commission. A strong summer if a New York day materializes.",
          "source": { "name": "Whitney Museum of American Art", "url": "https://whitney.org/exhibitions", "date": "Summer 2026", "confidence": "confirmed" }
        },
        {
          "lens": "One work to contemplate",
          "headline": "Alma Thomas, ‘Mars Dust’ (1972)",
          "body": "A dense field of vertical red strokes over deep blue, made the year NASA's Mariner 9 was mapping Mars. Thomas spent 35 years teaching art in D.C. public schools and had her first major museum recognition in her eighties — a life that rhymes with leadership that ripens slowly and gives itself away. On view now.",
          "why": "A patient, generative life in the arts — the kind of soul your own work keeps pointing toward.",
          "source": { "name": "Whitney Museum (collection)", "url": "https://whitney.org/collection/works/3043", "date": "1972", "confidence": "confirmed" },
          "image": { "credit": "Alma Thomas, Mars Dust, 1972. Acrylic on canvas, 69¼ × 57⅛ in. Whitney Museum of American Art, New York; purchase, with funds from The Hament Corporation 72.58. © Estate of Alma Thomas (Courtesy of the Hart Family) / Artists Rights Society (ARS), New York." }
        }
      ]
    },

    {
      "kind": "module",
      "id": "civic",
      "title": "Community & Civic",
      "glyph": "⬡",
      "accent": "verdigris",
      "summary": "Philadelphia is spending big on neighborhoods ahead of the nation's 250th — some of it claimable.",
      "items": [
        {
          "lens": "Local news that matters",
          "headline": "The city commits $100M to neighborhoods for the Semiquincentennial",
          "body": "Philadelphia is directing $100 million toward neighborhood initiatives for America's 250th birthday, explicitly aiming to spread the benefits to every neighborhood rather than center-city set pieces — community events, local businesses, and public art.",
          "source": { "name": "WHYY", "url": "https://whyy.org/articles/philadelphia-100m-investment-neighborhoods-250-anniversary/", "date": "2026", "confidence": "confirmed" }
        },
        {
          "lens": "An opportunity to act on",
          "headline": "Neighborhood Celebration Grants: $25K–$100K to local nonprofits",
          "body": "The city launched a $1M Neighborhood Celebration Grant Program offering $25,000–$100,000 to local nonprofits for community events, arts exhibitions, performances, historic commemorations, and beautification. Mural Arts is also painting 20 neighborhood-designed bells.",
          "why": "This is concretely claimable — Overbrook Presbyterian or a partner could fit a block celebration, commemoration, or arts project squarely inside these criteria.",
          "source": { "name": "FOX 29 Philadelphia", "url": "https://www.fox29.com/news/philadelphia-launches-1m-neighborhood-grants-new-app-ahead-2026-celebrations", "date": "2026", "confidence": "confirmed" }
        },
        {
          "lens": "A story worth holding",
          "headline": "In Kensington, a soccer club that is really a refuge",
          "body": "NPR profiled a Kensington youth soccer club giving kids a safe place to simply play, in a neighborhood long shaped by crime and the drug trade — small, unglamorous, durable community-building of exactly the kind that lasts.",
          "source": { "name": "NPR / VPM", "url": "https://www.vpm.org/npr-news/npr-news/2026-07-06/in-a-rough-philly-neighborhood-soccer-offers-kids-hope-and-joy", "date": "Jul 6, 2026", "confidence": "confirmed" }
        }
      ]
    },

    {
      "kind": "module",
      "id": "tech",
      "title": "Tech, AI & Tools",
      "glyph": "⌘",
      "accent": "bronze",
      "summary": "Signal, not noise — what actually changed and what it might be good for.",
      "items": [
        {
          "lens": "Signal, not hype",
          "headline": "Claude ‘Cowork’ comes to web and mobile — and keeps running when you're offline",
          "body": "Anthropic extended its Cowork agent (a delegate-a-task assistant, distinct from coding) to web and mobile for Max subscribers. You can hand it work from a desk, check status from your phone, and collect the result later — it continues even when none of your devices are online.",
          "why": "This is roughly the shape of what's assembling this brief — worth knowing as you think about delegating the recurring 'work around work.'",
          "source": { "name": "TechCrunch", "url": "https://techcrunch.com/2026/07/07/the-coding-agent-wars-are-spilling-into-the-rest-of-the-office-claude-cowork/", "date": "Jul 7, 2026", "confidence": "confirmed" }
        },
        {
          "lens": "One idea for the radar",
          "headline": "AI is quietly moving into science, government, and mission work",
          "body": "Anthropic also launched Claude Science (a research workbench) and put Claude into a FedRAMP-High government environment this month. The through-line: these tools are leaving the developer's terminal for domains — research, public service, nonprofits — closer to yours.",
          "source": { "name": "Anthropic", "url": "https://www.anthropic.com/news/claude-science-ai-workbench", "date": "Jul 2026", "confidence": "confirmed" }
        }
      ]
    },

    {
      "kind": "serendipity",
      "title": "One Wide Thing",